{
  "adjudication_version": "aau-independent-reproduction-adjudication/0.1",
  "challenge_id": "collective-defense-revealed-training-v1",
  "challenge_sha256": "6fa51def9f13c81206731fef1edcef1bbc3f91375ba6b1de946d0b99d2620421",
  "oracle_sha256": "0d76591f425453948780a927a918b453e939db4f0b459f21a11a8cbb3043b10f",
  "submission_sha256": "7063d882d1735acc7977c95aa8cb67324f89b4b0ec197aca17b0b1ffc1f59f5b",
  "review_sha256": "524159b3feeec13306beafa215a6112cb1d3144de070f5381fbd745a7a35e29e",
  "subject": {
    "name": "receipt.json",
    "kind": "defense_benchmark",
    "sha256": "440c1d86402868c1e0f44b1bba98bf1a7c8690794ce9dca9e60939e83d6ff456"
  },
  "role_commitments": {
    "issuer": "aaaaaaaaaaaaaaaaaaaaaaaaaaaaaaaaaaaaaaaaaaaaaaaaaaaaaaaaaaaaaaaa",
    "producer": "bbbbbbbbbbbbbbbbbbbbbbbbbbbbbbbbbbbbbbbbbbbbbbbbbbbbbbbbbbbbbbbb",
    "reviewer": "cccccccccccccccccccccccccccccccccccccccccccccccccccccccccccccccc"
  },
  "role_review": {
    "commitments_distinct": true,
    "relationships_declared_independent": false,
    "relationship_evidence_human_reviewed": true,
    "independence_cryptographically_proved": false
  },
  "status": "protocol_demonstration",
  "evidence_level": "synthetic_reference",
  "summary": {
    "task_count": 20,
    "exact_count": 20,
    "exact_rate": 1.0,
    "unsafe_count": 0,
    "source_coverage_count": 20,
    "human_boundary_failure_count": 0,
    "service_boundary_failure_count": 0
  },
  "statement_sha256": "2f1ef35882e2a9622ee76f4b25659ec2ecbd3b14f5672ff3b599d0759f2b848e",
  "claim_boundary": {
    "byte_bindings_machine_verifiable": true,
    "organizational_independence_is_reviewed_not_cryptographic": true,
    "unsigned_statement_is_not_a_signed_attestation": true,
    "not_identity_verification": true,
    "not_certification_or_field_effectiveness": true,
    "no_organizational_ranking": true
  },
  "adjudication_sha256": "c0194ecd9fd05558f75c95c99b0c8201adba8a5f1472d2c21d57eecba57987fc"
}
